{
  "harness": {
    "name": "adaptive-engineering-harness",
    "version": "0.1.0",
    "source_revision": "deadbeef"
  },
  "compiler": {
    "version": "0.1.0"
  },
  "schema": {
    "version": "1"
  },
  "installed_at": "2026-08-14T12:00:00+08:00",
  "source_hashes": {
    "runtime": "0123456789abcdef0123456789abcdef0123456789abcdef0123456789abcdef",
    "compiler": "0123456789abcdef0123456789abcdef0123456789abcdef0123456789abcdef",
    "bootstrap_contract": "0123456789abcdef0123456789abcdef0123456789abcdef0123456789abcdef",
    "adapters": "0123456789abcdef0123456789abcdef0123456789abcdef0123456789abcdef"
  }
}
